{
  "name": "Cookie policy",
  "title": "Cookie policy",
  "navigationCaption": "Cookie policy",
  "description": "Provide your customers with information about the cookie policy and make them aware of the GDPR compliant cookie usage in your shop, e.g. “In the following you can change your cookie settings.“"
}
