{
  "name": "Contact information",
  "title": "Contact information",
  "navigationCaption": "Contact information",
  "shortDescription": "<p>technic365</p>\r\n\r\n<p>Linen Hall<br />\r\n162- 168 Regent Street<br />\r\nLondon, W1B 5TF<br />\r\nGroßbritannien</p>",
  "description": "<p>Copyright 2009</p>",
  "company": "technic365",
  "contactPerson": "technic365 epages",
  "contactPersonJobTitle": "Webmaster",
  "address": "<p>Linen Hall<br />\r\n162- 168 Regent Street<br />\r\nLondon, W1B 5TF<br />\r\nGroßbritannien</p>",
  "phone": "+44-207 292 1790",
  "email": "epages.technic365@gmail.com"
}
