{
  "name": "Shipping terms",
  "title": "Shipping terms - Timo",
  "navigationCaption": "Delivery",
  "shortDescription": "Possible shipping types and the costs incurred",
  "description": "<p>On this page, provide your customers with detailed information about possible shipping types and the costs incurred. Also display the costs for shipment abroad.<p/><p>Specify which countries you ship to.</p>"
}